{
  "$schema": "https://json-schema.org/draft/2020-12/schema",
  "$id": "https://github.com/wanggang316/agent-pages/data.schema.json",
  "title": "agent-pages gallery",
  "type": "object",
  "additionalProperties": true,
  "required": ["version", "site", "updatedAt", "categories", "tags", "entries"],
  "properties": {
    "$schema": {
      "type": "string"
    },
    "version": {
      "type": "integer",
      "minimum": 1
    },
    "site": {
      "type": "object",
      "additionalProperties": true,
      "required": ["title"],
      "properties": {
        "title": {
          "type": "string",
          "minLength": 1
        }
      }
    },
    "updatedAt": {
      "type": "string"
    },
    "categories": {
      "type": "array",
      "items": {
        "$ref": "#/$defs/category"
      }
    },
    "tags": {
      "type": "array",
      "items": {
        "$ref": "#/$defs/tag"
      }
    },
    "entries": {
      "type": "array",
      "items": {
        "$ref": "#/$defs/entry"
      }
    }
  },
  "$defs": {
    "category": {
      "type": "object",
      "additionalProperties": false,
      "required": ["slug", "label"],
      "properties": {
        "slug": {
          "type": "string",
          "minLength": 1
        },
        "label": {
          "type": "string",
          "minLength": 1
        },
        "count": {
          "type": "integer",
          "minimum": 0
        }
      }
    },
    "tag": {
      "type": "object",
      "additionalProperties": false,
      "required": ["slug", "label", "count"],
      "properties": {
        "slug": {
          "type": "string",
          "minLength": 1
        },
        "label": {
          "type": "string",
          "minLength": 1
        },
        "count": {
          "type": "integer",
          "minimum": 0
        }
      }
    },
    "entry": {
      "type": "object",
      "additionalProperties": false,
      "required": ["title", "href", "date", "year", "category", "slug", "tags"],
      "properties": {
        "title": {
          "type": "string",
          "minLength": 1
        },
        "href": {
          "type": "string",
          "pattern": "^\\./"
        },
        "date": {
          "type": "string",
          "pattern": "^[0-9]{4}-[0-9]{2}-[0-9]{2}$"
        },
        "year": {
          "type": "string",
          "pattern": "^[0-9]{4}$"
        },
        "category": {
          "type": "string",
          "minLength": 1
        },
        "slug": {
          "type": "string",
          "minLength": 1
        },
        "tags": {
          "type": "array",
          "items": {
            "type": "string",
            "minLength": 1
          },
          "uniqueItems": true
        }
      }
    }
  }
}
