{
  "$schema": "./data.schema.json",
  "version": 1,
  "site": {
    "title": "Agent <Pages/>"
  },
  "updatedAt": "",
  "categories": [
    {
      "slug": "engineering",
      "label": "Engineering"
    },
    {
      "slug": "product",
      "label": "Product"
    },
    {
      "slug": "design",
      "label": "Design"
    },
    {
      "slug": "research",
      "label": "Research"
    },
    {
      "slug": "learning",
      "label": "Learning"
    },
    {
      "slug": "operations",
      "label": "Operations"
    },
    {
      "slug": "other",
      "label": "Other"
    }
  ],
  "tags": [],
  "entries": []
}
